{
  "id": "GROUNDED-TYPE-001",
  "kind": "guardrail",
  "name": "Invalid type registry JSON",
  "owner": "grounded",
  "status": "active",
  "description": "Defines the Invalid type registry JSON guardrail so validation, audit, and maintenance work can recognize this class of drift.",
  "summary": "The type registry must be valid JSON so spec kinds have an executable source of truth.",
  "references": [
    "PROJECT-GAP-001",
    "PROJECT-RULE-001"
  ]
}
