{
  "id": "GROUNDED-STYLE-002",
  "kind": "guardrail",
  "name": "Missing design tokens",
  "owner": "grounded",
  "status": "active",
  "description": "Defines the Missing design tokens guardrail so validation, audit, and maintenance work can recognize this class of drift.",
  "summary": "The central stylesheet should expose reusable design tokens for colors and spacing.",
  "references": [
    "PROJECT-RULE-001"
  ]
}
