{
  "id": "GROUNDED-REF-005",
  "kind": "guardrail",
  "name": "Reference target missing required typed tag",
  "owner": "grounded",
  "references": [
    "GROUNDED-DECISION-035",
    "PROJECT-RULE-001"
  ],
  "status": "active",
  "description": "Defines the Reference target missing required typed tag guardrail so validation and maintenance work can recognize constrained-reference drift.",
  "summary": "A reference field with a reference_tag_constraints rule points to a target spec that does not carry the required typed tag."
}
