{
  "id": "GROUNDED-EDGE-009",
  "kind": "guardrail",
  "name": "Semantic layer vocabulary stays small",
  "owner": "grounded",
  "status": "active",
  "description": "Defines the optional dependency-layer vocabulary used for depends_on direction checks.",
  "summary": "Allowed semantic_layer values are primitive, domain, application, interface, infrastructure, and generated.",
  "references": [
    "GROUNDED-DECISION-066"
  ],
  "tests": [
    "GROUNDED-TEST-034"
  ]
}
