{
  "id": "LATTICE-KIND-001",
  "kind": "guardrail",
  "name": "Unknown spec kind",
  "owner": "lattice",
  "status": "active",
  "description": "Defines the Unknown spec kind guardrail so validation, audit, and maintenance work can recognize this class of drift.",
  "summary": "Every spec kind must be registered in the type registry before specs can use it.",
  "references": [
    "PROJECT-RULE-001"
  ]
}
